{
  "documentType": "d2p:command-receipt",
  "schemaVersion": "1.0.0",
  "commandId": "cmd_golden-tshirt-change-1",
  "status": "committed",
  "revisionRefs": [
    {
      "artifactId": "art_golden-tshirt-pattern",
      "revisionId": "rev_golden-tshirt-pattern-r2"
    }
  ],
  "eventCursor": "golden-tshirt-1"
}
